Columna1;title;abstract
222;Assessing Greenhouse Gas Emissions and Health Co-Benefits: A Structured Review of Lifestyle-Related Climate Change Mitigation Strategies;This is the first structured review to identify and summarize research on lifestyle choices that improve health and have the greatest potential to mitigate climate change. Two literature searches were conducted on: (1) active transport health co-benefits, and (2) dietary health co-benefits. Articles needed to quantify both greenhouse gas emissions and health or nutrition outcomes resulting from active transport or diet changes. A data extraction tool (PRISMA) was created for article selection and evaluation. A rubric was devised to assess the biases, limitations and uncertainties of included articles. For active transport 790 articles were retrieved, nine meeting the inclusion criteria. For diet 2524 articles were retrieved, 23 meeting the inclusion criteria. A total of 31 articles were reviewed and assessed using the rubric, as one article met the inclusion criteria for both active transport and diet co-benefits. Methods used to estimate the effect of diet or active transport modification vary greatly precluding meta-analysis. The scale of impact on health and greenhouse gas emissions (GHGE) outcomes depends predominately on the aggressiveness of the diet or active transport scenario modelled, versus the modelling technique. Effective mitigation policies, infrastructure that supports active transport and low GHGE food delivery, plus community engagement are integral in achieving optimal health and GHGE outcomes. Variation in culture, nutritional and health status, plus geographic density will determine which mitigation scenario(s) best suit individual communities.
223;Climate Change and Mental Health: Implications for Nurses.;Climate change has received public health attention over the past 3 decades. It is well established that climate change is associated with myriad health issues, but less has been mentioned in public health discourse about the impacts of climate change on population mental health. The purpose of the current article is to provide an overview of the impacts of climate change on mental health, and to discuss opportunities for mental health nurses to reduce health problems related to climate change. Acute events and chronic consequences of climate change can impact mental health outcomes and contribute to depressive disorders, anxiety, and trauma-related disorders. The nursing profession must be prepared to address climate change to promote best health outcomes for individuals around the globe. It is critical that mental health nurses act as leaders in understanding and addressing climate change to improve the mental health of populations. [Journal of Psychosocial Nursing and Mental Health Services, xx(x), xx-xx.].
224;Climate Change and Cascading Risks from Infectious Disease;"Climate change is adversely affecting the burden of infectious disease throughout the world, which is a health security threat. Climate-sensitive infectious disease includes vector-borne diseases such as malaria, whose transmission potential is expected to increase because of enhanced climatic suitability for the mosquito vector in Asia, sub-Saharan Africa, and South America. Climatic suitability for the mosquitoes that can carry dengue, Zika, and chikungunya is also likely to increase, facilitating further increases in the geographic range and longer transmission seasons, and raising concern for expansion of these diseases into temperate zones, particularly under higher greenhouse gas emission scenarios. Early spring temperatures in 2018 seem to have contributed to the early onset and extensive West Nile virus outbreak in Europe, a pathogen expected to expand further beyond its current distribution, due to a warming climate. As for tick-borne diseases, climate change is projected to continue to contribute to the spread of Lyme disease and tick-borne encephalitis, particularly in North America and Europe. Schistosomiasis is a water-borne disease and public health concern in Africa, Latin America, the Middle East, and Southeast Asia; climate change is anticipated to change its distribution, with both expansions and contractions expected. Other water-borne diseases that cause diarrheal diseases have declined significantly over the last decades owing to socioeconomic development and public health measures but changes in climate can reverse some of these positive developments. Weather and climate events, population movement, land use changes, urbanization, global trade, and other drivers can catalyze a succession of secondary events that can lead to a range of health impacts, including infectious disease outbreaks. These cascading risk pathways of causally connected events can result in large-scale outbreaks and affect society at large. We review climatic and other cascading drivers of infectious disease with projections under different climate change scenarios. 5E6fdnCC7GZ6vtJap2g1wp Supplementary file1 (MP4 328467 KB) Supplementary file1 (MP4 328467 KB)"
225;The Implications of Climate Change for Children in Lower-Income Countries;Abstract:This article provides a brief overview of the implications for children of climate change—both of extreme weather events and more gradual changes, along with the adaptations likely to be made at various levels. Because data on the impacts of climate change tend not to be disaggregated by sub-population or by age, there is insufficient knowledge to present a comprehensive picture of the impacts for this age group. Instead, this paper extrapolates from existing knowledge in a number of related areas to present a picture of the probable implications for children's health, safety, and long-term well being, especially in lower-income countries and communities that are at highest risk from climate change. The article stresses not only children's vulnerability, but also their resilience and their capacity as active agents to play a role in addressing the challenges they confront related to climate change.
226;Social and health dimensions of climate change in the Amazon;Abstract Context: The Amazon region has been part of climate change debates for decades, yet attention to its social and health dimensions has been limited. Objective: This paper assesses literature on the social and health dimensions of climate change in the Amazon. A conceptual framework underscores multiple stresses and exposures created by interactions between climate change and local social-environmental conditions. Methods: Using the Thomson-Reuter Web of Science, this study bibliometrically assessed the overall literature on climate change in the Amazon, including Physical Sciences, Social Sciences, Anthropology, Environmental Science/Ecology and Public, Environmental/Occupational Health. From this assessment, a relevant sub-sample was selected and complemented with literature from the Brazilian database SciELO. Results: This sample discusses three dimensions of climate change impacts in the region: livelihood changes, vector-borne diseases and microbial proliferation, and respiratory diseases. This analysis elucidates imbalance and disconnect between ecological, physical and social and health dimensions of climate change and between continental and regional climate analysis, and sub-regional and local levels. Conclusion: Work on the social and health implications of climate change in the Amazon falls significantly behind other research areas, limiting reliable information for analytical models and for Amazonian policy-makers and society at large. Collaborative research is called for.
227;Climate change and vector-borne diseases of public health significance;There has been much debate as to whether or not climate change will have, or has had, any significant effect on risk from vector-borne diseases. The debate on the former has focused on the degree to which occurrence and levels of risk of vector-borne diseases are determined by climate-dependent or independent factors, while the debate on the latter has focused on whether changes in disease incidence are due to climate at all, and/or are attributable to recent climate change. Here I review possible effects of climate change on vector-borne diseases, methods used to predict these effects and the evidence to date of changes in vector-borne disease risks that can be attributed to recent climate change. Predictions have both over- and underestimated the effects of climate change. Mostly under-estimations of effects are due to a focus only on direct effects of climate on disease ecology while more distal effects on society's capacity to control and prevent vector-borne disease are ignored. There is increasing evidence for possible impacts of recent climate change on some vector-borne diseases but for the most part, observed data series are too short (or non-existent), and impacts of climate-independent factors too great, to confidently attribute changing risk to climate change.
228;Prevalence and determinants of mental health related to climate change in Australia;"Aims: The climate emergency will likely prove this century’s greatest threat to public health within which mental health effects need consideration. While studies consistently show the majority of Australians are very concerned about the impacts of climate change, there is limited evidence from nation-wide research linking climate change with mental health burden in sub-populations. This study aimed to understand the impact of climate change on mental health in the Australian population and identify populations who are most at risk of climate-related mental health burden. Methods: A nation-wide Australian survey conducted between August and November 2020 of adults was approximately representative across sex, age, location, state and area disadvantage. Two-stage recruitment involved unrestricted self-selected community sample through mainstream and social media (N = 4428) and purposeful sampling using an online panel (N = 1055). Results: Most Australians report having a direct experience of a climate change–related event. Young people are experiencing significant rates of eco-anxiety. One in four people with direct experience of a climate change–related event met post-traumatic stress disorder screening criteria. People who have not had a direct experience are showing symptoms of pre-trauma, particularly in younger age groups and women. There were 9.37% (503/5370) of respondents with responses indicating significant eco-anxiety, 15.68% (370/2359) with pre-traumatic stress and 25.60% (727/2840) with post-traumatic stress disorder. Multivariable regressions confirmed that younger people are more affected by eco-anxiety and post-traumatic stress disorder (pre- or post-trauma); women are more affected by post-traumatic stress disorder (pre- or post-trauma) and those from more disadvantaged regions are more affected by eco-anxiety. Conclusion: Australia is facing a potential mental health crisis. Individuals with and without direct experience of climate change are reporting significant mental health impacts, with younger age groups being disproportionately affected. There are key roles for clinicians and other health professionals in responding to and preventing climate-related mental health burden."
229;Climate Change and Mental Health.;": Climate change is an enormous challenge for our communities, our country, and our world. Recently much attention has been paid to the physical impacts of climate change, including extreme heat events, droughts, extreme storms, and rising sea levels. However, much less attention has been paid to the psychological impacts. This article examines the likely psychological impacts of climate change, including anxiety, stress, and depression; increases in violence and aggression; and loss of community identity. Nurses can play a vital role in local and regional climate strategies by preparing their patients, health care facilities, and communities to effectively address the anticipated mental health impacts of climate change."
230;Climate Change and Zoonoses: A Review of Concepts, Definitions, and Bibliometrics;"Climate change can have a complex impact that also influences human and animal health. For example, climate change alters the conditions for pathogens and vectors of zoonotic diseases. Signs of this are the increasing spread of the West Nile and Usutu viruses and the establishment of new vector species, such as specific mosquito and tick species, in Europe and other parts of the world. With these changes come new challenges for maintaining human and animal health. This paper reports on an analysis of the literature focused on a bibliometric analysis of the Scopus database and VOSviewer software for creating visualization maps which identifies the zoonotic health risks for humans and animals caused by climate change. The sources retained for the analysis totaled 428 and different thresholds (N) were established for each item varying from N 5 to 10. The main findings are as follows: First, published documents increased in 2009–2015 peaking in 2020. Second, the primary sources have changed since 2018, partly attributable to the increase in human health concerns due to human-to-human transmission. Third, the USA, the UK, Canada, Australia, Italy, and Germany perform most zoonosis research. For instance, sixty documents and only 17 countries analyzed for co-authorship analysis met the threshold led by the USA; the top four author keywords were “climate change”, “zoonosis”, “epidemiology”, and “one health;” the USA, the UK, Germany, and Spain led the link strength (inter-collaboration); the author keywords showed that 37 out of the 1023 keywords met the threshold, and the authors’ keyword’s largest node of the bibliometric map contains the following: infectious diseases, emerging diseases, disease ecology, one health, surveillance, transmission, and wildlife. Finally, zoonotic diseases, which were documented in the literature in the past, have evolved, especially during the years 2010–2015, as evidenced by the sharp augmentation of publications addressing ad-hoc events and peaking in 2020 with the COVID-19 outbreak."
231;Talking about Climate Change and Environmental Degradation with Patients in Primary Care: A Cross-Sectional Survey on Knowledge, Potential Domains of Action and Points of View of General Practitioners;Purpose: General practitioners (GPs) could play a role in mitigating climate change by raising awareness of its impact on human health and implementing changes to improve population health and decreasing environmental footprints. The aim of this study was to assess GPs’ knowledge and perspectives about the health impacts of climate change. Method: A questionnaire was sent to 1972 GPs in the French-speaking part of Switzerland. Knowledge of the impact of environmental degradations and climate change on health and willingness to address climate change with patients, to be exemplary and to act as role models were surveyed as well as demographic characteristics of GPs. Results: Respondents (N = 497) expressed a high level of self-reported knowledge regarding climate change, although it was lower for more specific topics, such as planetary health or health–environment co-benefits. Participants mostly agreed that it is necessary to adapt clinical practice to the health impacts of climate change and that they have a role in providing information on climate change and its links to human health. Conclusion: Most of the GPs were concerned about environmental and climate degradation. However, this study revealed a gap between the willingness of GPs to integrate the impact of climate change on health into their clinical activities and their lack of overall knowledge and scientific evidence on effective interventions. A promising way forward may be to develop co-benefit interventions adapted to the clinical setting on diet, active mobility and connecting with nature.
232;Climate Change and Public Health;It is clear that the public health community is concerned about the human health impacts of climate change, but are we inadvertently underestimating the scope of the problem and obfuscating potentially useful interventions by using a narrow intellectual frame in our discussions with policy makers? If we take a more holistic approach, we see that the public health impacts of climate change are only one subset of the enormous public health impacts of fossil fuel burning. This broader perspective can provide a more accurate and comprehensive assessment that is more useful for decision making in public policy settings.
233;An investigation into the relationship between climate change anxiety and mental health among Gen Z Filipinos;"Climate change and mental health concerns are both defining issues of the generation of today. It has been established that the worsening climate causes many environmental disasters and physical health problems. However, its psychological impacts are still not well understood. Climate change has brought about an emerging psychological phenomenon termed ‘climate anxiety’ or ‘eco-anxiety,’ which has been described as a ""chronic fear of environmental doom"" (Clayton et al., 2017 , p. 68) due to the impact of climate change. This predictive cross-sectional study investigated the link between climate change anxiety and mental health among 433 Filipinos. A total of 145 males and 288 females aged 18 to 26 completed the Climate Change Anxiety Scale and the Mental Health Inventory (MHI-38). Results show a significant relationship between climate change anxiety and mental health, with climate change anxiety predicting 13.5% of the overall Mental Health Index variance. Significantly, climate change anxiety was associated with the MHI-38’s global scale of Psychological Distress but not with the global scale of Psychological Well-being. The findings are discussed concerning the broader context of research on the mental health impacts of climate change."
234;Aboriginal Population and Climate Change in Australia: Implications for Health and Adaptation Planning;The health impacts of climate are widely recognised, and extensive modelling is available on predicted changes to climate globally. The impact of these changes may affect populations differently depending on a range of factors, including geography, socioeconomics and culture. This study reviewed current evidence on the health risks of climate change for Australian Aboriginal populations and linked Aboriginal demographic data to historical and projected climate data to describe the distribution of climate-related exposures in Aboriginal compared to non-Aboriginal populations in New South Wales (NSW), Australia. The study showed Aboriginal populations were disproportionately exposed to a range of climate extremes in heat, rainfall and drought, and this disproportionate exposure was predicted to increase with climate change over the coming decades. Aboriginal people currently experience higher rates of climate-sensitive health conditions and socioeconomic disadvantages, which will impact their capacity to adapt to climate change. Climate change may also adversely affect cultural practices. These factors will likely impact the health and well-being of Aboriginal people in NSW and inhibit measures to close the gap in health between Aboriginal and non-Aboriginal populations. Climate change, health and equity need to be key considerations in all policies at all levels of government. Effective Aboriginal community engagement is urgently needed to develop and implement climate adaptation responses to improve health and social service preparedness and secure environmental health infrastructure such as drinking water supplies and suitably managed social housing. Further Aboriginal-led research is required to identify the cultural impacts of climate change on health, including adaptive responses based on Aboriginal knowledges.
235;Climate Change and Public Health Surveillance: Toward a Comprehensive Strategy;Context: Climate change poses a host of serious threats to human health that robust public health surveillance systems can help address. It is unknown, however, whether existing surveillance systems in the United States have adequate capacity to serve that role, nor what actions may be needed to develop adequate capacity. Objective: Our goals were to review efforts to assess and strengthen the capacity of public health surveillance systems to support health-related adaptation to climate change in the United States and to determine whether additional efforts are warranted. Methods: Building on frameworks issued by the Intergovernmental Panel on Climate Change and the Centers for Disease Control and Prevention, we specified 4 core components of public health surveillance capacity relevant to climate change health threats. Using standard methods, we next identified and analyzed multiple assessments of the existing, relevant capacity of public health surveillance systems as well as attempts to improve that capacity. We also received information from selected national public health associations. Findings: Multiple federal, state, and local public health agencies, professional associations, and researchers have made valuable, initial efforts to assess and strengthen surveillance capacity. These efforts, however, have been made by entities working independently and without the benefit of a shared conceptual framework or strategy. Their principal focus has been on identifying suitable indicators and data sources largely to the exclusion of other core components of surveillance capacity. Conclusions: A more comprehensive and strategic approach is needed to build the public health surveillance capacity required to protect the health of Americans in a world of rapidly evolving climate change. Public health practitioners and policy makers at all levels can use the findings and issues reviewed in this article as they lead design and execution of a coordinated, multisector strategic plan to create and sustain that capacity.
236;Challenges and Opportunities for Advancing Work on Climate Change and Public Health;"Climate change poses a major threat to public health. Strategies that address climate change have considerable potential to benefit health and decrease health inequities, yet public health engagement at the intersection of public health, equity, and climate change has been limited. This research seeks to understand the barriers to and opportunities for advancing work at this nexus. We conducted semi-structured in-depth interviews (N = 113) with public health and climate change professionals and thematic analysis. Barriers to public health engagement in addressing climate change include individual perceptions that climate change is not urgent or solvable and insufficient understanding of climate change’s health impacts and programmatic connections. Institutional barriers include a lack of public health capacity, authority, and leadership; a narrow framework for public health practice that limits work on the root causes of climate change and health; and compartmentalization within and across sectors. Opportunities include integrating climate change into current public health practice; providing inter-sectoral support for climate solutions with health co-benefits; and using a health frame to engage and mobilize communities. Efforts to increase public health sector engagement should focus on education and communications, building leadership and funding, and increasing work on the shared root causes of climate change and health inequities."
237;Nurses' Perspectives on Climate Change, Health, and Nursing Practice.;AIM The purpose of this study was to explore Canadian nurses' perspectives on climate change, health, nursing practice, and the relationships between these concepts.   BACKGROUND Climate change negatively impacts human health. With a mandate to promote health, nurses have a professional and ethical responsibility to address climate change. Little is known about Canadian nurses' perspectives on climate change or how they perceive of their professional responsibility towards addressing it.   METHODS A focused ethnography was conducted in three medicine units and the emergency room at a Canadian hospital. Nurses (n=22) participated in semi-structured interviews and observations were collected. Data were analysed via thematic analysis. Reporting is in accordance with the COREQ guideline.   RESULTS Three themes were identified: muddled terminology, climate change and health, and nursing's relationship to climate change.   CONCLUSION Participants had varying levels of knowledge about climate change and its relationship to health or practice. Climate change was a personal concern and nursing's role in addressing it was not understood.   RELEVANCE TO PRACTICE This study highlighted that practicing nurses did not readily recognize their role in addressing climate change. More work is needed to clarify this role and bring it into the consciousness of every-day nursing practice. Furthermore, more work is needed to examine how healthcare organizations can better support environmentally responsible nursing practice.
