Columna1;title;abstract
114;The kids aren’t alright;"<p>Will a new-born experience more impacts from climate change compared to a 60-year old? While the obvious answer to this question is yes, impacts accumulated across an average person&#8217;s lifetime have so far not been quantified. Providing such information is however relevant and timely, given the recent surge in societal debate regarding inter-generational solidarity and considering ongoing climate litigation. Here we combine multi-model impact projections from the Inter-Sectoral Impact Model Intercomparison Project (ISIMIP) with temperature trajectories from the IPCC special report on warming of 1.5&#176;C and life expectancy data from the World Bank to compute accumulated impact exposure across lifetimes of people in different age groups and countries. We consider six impacts categories (droughts, heatwaves, tropical cyclones, crop failure, floods, and wildfires), for which ISIMIP provides a total of 170 impact projections with 15 different impact models under RCP2.6 and 6.0. Our results highlight that the combined increase in life expectancy and unfolding climate impacts leads to 2-4 times more impacts affecting a new-born compared to a 60-year old person under current policy pledges. Globally, the increase in exposure for young people is dominated by the strong increase in heatwave hazards. The strongest increases occur in low and lower-middle income countries, where rising impacts compound a substantial increase in life expectancy. Our results overall highlight the strong benefit of aligning policies with the Paris Agreement for safeguarding the future of current young generations.</p>"
115;A three year study on the soil water availability at roadside trees in Hamburg, Germany;"<p>The benefit of urban roadside trees to provide ecosystem services and wellbeing of human in expanding and compacted cities gets more and more attention. For northern Germany it is predicted that climate change rises summer temperatures and that precipitation patterns shift to drier vegetation periods. In cities, those impacts will intensify water (soil sealing) and heat problems (urban heat island) even more. Furthermore, roadside trees have to deal with several specific site limitations like extreme soil compaction and soil sealing, low water infiltration rates, sandy and anthropogenic deposited substrates, and soil volume restrictions. The consequences for the trees are drought stress combined with reduced vitality and life expectancy.</p><p>Our research is based on soil water monitoring at 17 roadside plantation sites across the city of Hamburg.&#160; We focus on the water availability of prepared planting soils and the development of the trees root systems. Sensors for soil water tension and soil temperature were installed in different soil areas of each site: topsoil, root ball, tree pit substrate, lateral space, and subsoil. The general goal of this study was to characterize the soil water availability at roadside planting pits during the first years after plantation (here: 2017, 2018 and 2019). Based on these results the long-term objective is to elaborate recommendations for the soil-related technology of future urban tree planting sites. The Creation of more suitable conditions in the planting site enhances roadside tree vitality and provides ecosystem services by the trees on a higher level.</p><p>The data analysis focused on two main aspects. First, the effect of weather conditions, especially &#160;the extreme wet and dry vegetation periods, on the soil water availability in the tree pit. Second, the three-year temporal development of soil water distribution in the different soil areas within the planting pitafter plantation.</p><p>We found that soil water availability in the vegetation period (VP; April-October) at the investigated roadside plantation sites are highly correlated to weather conditions (air temperature (aT) and precipitation (P)). During a cold and wet VP (aT: 14,0 &#176;C, P: 631 mm), soil tensions reached a critical value on average at 24 &#177; 18 days (11 &#177; 9 % of VP). In a hot and dry VP (aT: 16,0 &#176;C, P: 222 mm), soil tensions reached a critical value on average at 115 &#177; 22 days (54 &#177; 10 % of VP).</p><p>Furthermore, the results showed that soil water scarcity in the first VP occurred mainly in the root ball, whereas during the second VP water scarcity developed in all soil areas within the planting site, except for the subsoil. Although the amount of precipitation during the last vegetation period was more than doubled compared to the second, the subsoil reached higher water tensions. This finding leads to the conclusion that root development after plantation took place from the root ball over the prepared planting soil into the surrounding soil within depths of up to 1 m. &#160;</p>"
116;What can public health do about it? How public health projects and programs can be more sustainable;Our global society has evolved in the last century at an astonishing pace, with human population more than doubling in the last 50 years. Public Health has been largely influenced in a positive way by the social and technological advancements that lead to a decrease in child mortality and an increase in life expectancy. However, the accelerated pace of climate change and its predicted impact on population health is one of the greatest challenges the human species faces. There are many ways PH can contribute in that challenge, from legislative action and advocacy to reduce greenhouse gas emissions and toxic waste on a global scale to small projects that tackle locally specific problems.        This presentation is part of a workshop on how individuals and public health (PH) can create a more sustainable world. It aims specifically to present examples and ideas of how to make current public health projects at a local level more sustainable.        Several examples will be discussed during the presentation, including the adherence to European directives, like reducing the amount of paper used in projects, and the focus on the environmental impacts of each program implemented, creating a mindset of “sustainability in all action”.        There seems to be a global concern about climate change, with many strategic documents and agreements outlining the path for a more sustainable world. However, there is also a clear difficulty in translating those strategies to action in our everyday Public Health practice. The changes referred during this presentation might not be directly related to the main goal of the project or program, yet they by contributing to climate action they will also contribute to population health gains.
117;Moving From Data to Action: Necessary Next Steps to a Better Governmental Public Health Workforce;We live in a time of unprecedented health transformation. Health disparities of all types (rural, age, race, and gender) are steady, if not increasing, and for the first time in US history, overall life expectancy is declining. Climate change, opioid misuse and addiction, integration of physical and behavioral health, and persistent rates of chronic disease are both contemporary and emerging public health problems. Tackling these problems from the governmental public health perspective requires a competent, adaptive, diverse, and engaged workforce. We cannot expect to achieve heath improvement in communities nationwide without strong public health agencies built on a foundation of well-trained and innovative public health practitioners. Building this foundation requires deliberate and thoughtful leadership, robust strategic thinking and implementation, and the resources needed to carry out public health’s comprehensive mission. There were no nationally representative data on the governmental public health agency workforce before 2014. National data that were available were collected at the agency level. While these surveys provided valuable insights into staffing levels, budget changes, and other important topics, they did not capture the beliefs, attitudes, opinions, and experiences of individual public health workers. Efforts to survey individual members of the governmental public health workforce were limited by differences in data collection methods, time frames, and questionnaire
118;The Dominance of Food Supply in Changing Demographic Factors across Africa: A Model Using a Systems Identification Approach;Demographic indicators linked to general health have been strongly linked to economic development. However, change in such indicators is also associated with other factors such as climate, water availability, and diet. Here, we use a systems modelling approach, bringing together a range of environmental, economic, dietary, and health factors, to seek possible dominant causes of demographic change across Africa. A continent-wide, north-south transect of countries allows for the exploration of a range of climates, while a longitudinal transect from the Atlantic to the Red Sea provides a range of socio-economic factors within the similar climatic regime of Sahelian Africa. While change in national life expectancy and death rate since 1960 is modelled to be linked to a varying number and type of factors across the transects, the dominant factor in improving these demographic indicators across the continent is food availability. This has been strongly modulated by HIV infection rates in recent decades in some countries.
119;Towards Sustainable Urban Development: the Ukrainian situation;"Abstract The continuing process of urbanization sets up urgent issues of environmental degradation resulting in disrupting opportunities to enhance quality of life of the population. In Ukraine, the anthropogenic and human impacts on the environment are several times higher than in developed countries. Thus, life expectancy in Ukraine is on average around 68 years (e.g. in Italy – 82, Sweden - 80, Poland - 74) which is largely due to the environmental pollution which is the result of production activities of mining, metallurgy, chemical industries, fuel and energy complex. Therefore, there is a strong need in the Ukrainian society to address the consequences of powerful external forces as environmental pollution and climate change, and internal forces as socioeconomic development. These forces play a role at all levels but are prevalent at urban levels. Cities are not isolated entities; they interact with their surroundings, economically, socio-politically and environmentally. Urban development toward sustainability has to consider the capacity of the entire ecosystem to support such development including the prevention and mitigation of adverse environmental impacts of the outside urban areas. Hence, cities are unique territories to implement green economy opportunities to ensure the development of sustainable societies. Exploring different dimensions of sustainability should be connected with the exploration of urban processes and developments on a global level. This connection shows how sustainability can be destroyed or ensured. Sustainability should be based on social cohesion in local urban areas and contribute to sustainable urban development."
120;The local importance of global infectious diseases;Dengue in Tokyo and Key West. Leishmaniasis in Madrid and Texas. Chikungunya in Ravenna and Puerto Rico. SARS in Toronto. Ebola in Dallas. And measles everywhere. Population growth, globalization, climate change and urbanization together are reshaping the context upon which we must consider the global spread of emerging and historically tropical infectious diseases and their interface with non-communicable diseases of transitioning societies. We live on a crowded and interconnected planet, with a projected global human population of at least 9 billion by 2050 [1]. Public health advances such as safe water, adequate sanitation, antibiotics, vaccines and balanced nutrition programs have extended overall life expectancy, even in remote, under-developed settings. The resulting unprecedented population surge has contributed to numerous challenges that will increasingly serve as counter-balances to these public health advances and will synergize with other inter-related factors such globalization, climate change and urbanization to contribute to the spread of dangerous infectious diseases. International travel and immigration increase each year, with more than 1 billion humans crossing international borders in 2013 alone [2]. Many cross to embrace economic opportunities or to escape war or disaster. Many also travel to visit family or friends, or for business, education or leisure purposes. Exotic, remote and dangerous locations—often lacking public health infrastructure—are increasingly common destinations for travelers as well as sources of immigrants to the developed world. This “smaller world” effect brings with it much good in terms of societal connectedness and economic stimulation, but also individual risk to the traveler and the opportunity for spread of disease upon return. Our current age of globalization also involves the increasingly rapid and direct transportation of food and
121;Introduction to ICCS/ESCCA Consensus Guidelines to Detect GPI‐Deficient Cells in Paroxysmal Nocturnal Hemoglobinuria and Related Disorders;Since the seminal discoveries of the relationship between the underlying genetic mutation and the altered expression of GPI-linked antigen expression that underlies the pathobiology of paroxysmal nocturnal hemoglobinuria (PNH), flow cytometry and the immunophenotypic detection of PNH clones has played an increasingly important role in the diagnosis, monitoring, and clinical management of patients with PNH (1–3). With the successful introduction of complement blockade therapies for PNH (4), the condition has changed from one with a poor outcome (5) to one where life expectancy matches that of the normal population (6). With complement blockade therapies well established for PNH, and more alternatives on the horizon, diagnosis of PNH and monitoring of treatment efficacy has never been more important, given the particularly high cost of therapy. Since the publication in 2010 of the International Clinical Cytometry Society (ICCS) Consensus Guidelines for detection of PNH by flow cytometry (7), a significant “climate change” in the provenance of clinical flow cytometry testing in general has occurred. Contemporary guidelines are now driven by the expectations that clinical flow cytometry laboratories will work to ISO15189 standards or National Regulatory requirements that require documented validation of all tests offered. Furthermore, regulatory bodies and other stakeholders now require validation of methods used for clinical trials where flow cytometry methods are used for diagnosis, to monitor responses to therapy, or define clinical endpoints. On this background of accreditation and validation, professional societies such as ICCS and ESCCA are now actively enlisting expertise to produce practical guidelines that address all aspects of clinical flow cytometry assays. In this edition of Clinical Cytometry, four articles are presented that provide an updated and significantly improved comprehensive practical guide to PNH testing. In the first of these, Dezern and Borowitz (8) present a detailed account of the role of PNH testing and how it contributes to the diagnosis, classification, and monitoring of patients. When interpreted correctly, the results from PNH flow cytometry testing, including presence and size of the clonal populations and the cell types involved, can allow the clinician to classify the disease appropriately, evaluate the risk of disease progression, and subsequently monitor response to therapy. The second section of these updated ICCS PNH Consensus Guidelines concentrates on specific instrument setup for PNH assays, together with the identification and testing of appropriate antibody conjugates (9). Assay design is also covered in great detail and underlines principles that can be transferred to other immunophenotyping procedures. In part 3, Illingworth et al. offer practical guidance on the analysis and reporting of PNH results using a fully optimized assay (10). They also address the most common analytical challenges for accurate reporting of results. Furthermore, the authors supply an extensive case library to assist in the interpretation of more difficult cases, drawn from their many years of experience. In the final section, Oldaker et al. not only provide a comprehensive guide on how to validate the flow cytometric procedures described in parts 2 and 3, but also detail the differences between cell-based and traditional soluble analyte assay validations (11). The procedures described are based on the recommendations of a number of stakeholders who provide external guidance and general recommendations together with the published experience of experts in the area of PNH testing. The overall goal is to provide practical assay-specific guidelines for the validation of high-sensitivity flow cytometric PNH assays. For clinical laboratories it is important recognize that the ultimate beneficiary of the complex process of assay development, optimization, and validation processes has to be the patient. For a rare disease such as PNH, diagnostic testing with the knowledge that an assay has been through a comprehensive validation process is critically important. When a new diagnosis of PNH is made this can have life changing and potentially lifelong implications for individual patients. These updated and comprehensive guidelines for PNH testing are the result of many hours of dedication from all contributors. Specific thanks have to go to Andrea Illingworth and Rob Sutherland who have
122;Neurological letter from Chad;"Chad is a landlocked country in central sub-Saharan Africa (figures 1–3). In 2015, the United Nations Development Program ranked Chad 185 out of 188 countries on the Human Development Index.1 Most of the approximately 14.5 million Chadians live in extreme poverty and deprivation; absolute poverty is expected to rise from 4.7 million people in 2012 to 6.3 million people in 2019.1 The life expectancy in Chad is just 51 years. Chad also suffers from so-called desertification from climate change, with large areas of dry land becoming increasingly arid, particularly in and around Lake Chad, which has shrunk 95% of its size in recent years with only modest recovery.1 2 In 2003, Chad became a petrol-producing country, and the current president is now in his fifth term of office.1 2 Long-term violence also affects Chad including intrastate conflicts. Four per cent of the population of Chad are refugees,1 many seeking asylum from recent wars in neighbouring countries, particularly in South Sudan and Central African Republic.    Figure 1  Location of Chad in Africa.      Figure 2  The flag of Chad.      Figure 3  Coat of arms of Chad.    Almost nothing is officially reported on neurological disorders in Chad. Although Chad has eradicated poliomyelitis, it remains a high-risk region for reimportation of this virus from neighbouring regions prone to epidemic outbreaks.3 Many children remain at risk of a range of vaccine-preventable neurological diseases because of low vaccination …"
123;THE ANTHROPOCENE AND THE LONGEVITY REVOLUTION;"Abstract The Anthropocene, a term popularized in 2010 by Nobel Prize-winning chemist Paul Crutzen, refers to the current epoch during which human beings have begun to have a significant impact on the earth, e.g., the environment and climate change. Global population has grown approximately seven-fold over the past 200 years, while average life expectancy at birth has dramatically increased due to improvements in nutrition, medicine, and technology. The human Longevity Revolution thus provides important evidence of the Anthropocene. Yet, in the face of the Anthropocene, contemporary lifestyles rooted in capitalism–continually seeking more and bigger–are not sustainable; changes are needed for humanity to “live long on the damaged planet.” This presentation will discuss the Longevity Revolution in the context of the theory and previous research on the Anthropocene, then suggest an agenda for future research related to the intersection between the Anthropocene and the Longevity Revolution."
124;Remember Me? The Bone Marrow in Pulmonary Fibrosis;"1. Pope CA III, Ezzati M, Dockery DW. Fine-particulate air pollution and life expectancy in the United States. N Engl J Med 2009;360:376–386. 2. Jerrett M, Burnett RT, Pope CA III, Ito K, Thurston G, Krewski D, et al. Long-term ozone exposure and mortality. N Engl J Med 2009;360: 1085–1095. 3. Turner MC, Jerrett M, Pope CA III, Krewski D, Gapstur SM, Diver WR, et al. Long-term ozone exposure and mortality in a large prospective study. Am J Respir Crit Care Med 2016;193:1134–1142. 4. Lim CC, Hayes RB, Ahn J, Shao Y, Silverman DT, Jones RR, et al. Longterm exposure to ozone and cause-specific mortality risk in the United States. Am J Respir Crit Care Med 2019;200:1022–1031. 5. Orru H, Ebi KL, Forsberg B. The interplay of climate change and air pollution on health. Curr Environ Health Rep 2017;4:504–513. 6. American Lung Association. State of the air report; 2019 [accessed 2019 June 2]. Available from: https://www.lung.org/our-initiatives/healthyair/sota/city-rankings/. 7. Basu R, Samet JM. Relation between elevated ambient temperature and mortality: a review of the epidemiologic evidence. Epidemiol Rev 2002;24:190–202. 8. Bhattacharya S. European heatwave caused 35,000 deaths. New Scientist 2003 Oct 10; [accessed 2019 June 2]. Available from: https://www.newscientist.com/article/dn4259-european-heatwavecaused-35000-deaths. 9. Filleul L, Cassadou S, Médina S, Fabres P, Lefranc A, Eilstein D, et al. The relation between temperature, ozone, and mortality in nine French cities during the heat wave of 2003. Environ Health Perspect 2006; 114:1344–1347. 10. Shen L, Mickley LJ, Gilleland E. Impact of increasing heat waves on U.S. ozone episodes in the 2050s: results from a multimodel analysis using extreme value theory. Geophys Res Lett 2016;43: 4017–4025. 11. U.S. EPA. Integrated science assessment (ISA) for particulate matter (final report, Dec 2009); 2009. U.S. Environmental Protection Agency, Washington, DC; EPA/600/R-08/139F [accessed 2019 Jun 1]. Available from: https://cfpub.epa.gov/ncea/isa/recordisplay. cfm?deid=216546 12. Goldman GT, Dominici F. Don’t abandon evidence and process on air pollution policy. Science 2019;363:1398–1400."
125;Constitutional Cohesion and Public Health Promotion - Part II;James G. Hodge, Jr. Public health across the United States is in trouble. Government de-funding and de-authorizations are gutting many traditional public health functions. The spread of multiple preventable diseases is on the rise. Rates of some chronic conditions and injuries are increasing. Life expectancy among select American subpopulations is actually going down.1 Coextensively, modern assessments reveal threats to social determinants of health. Prevailing federal and state health and tax policies fall hard on lower and middle classes.2 Deregulatory efforts in health care, housing, education, and climate change may negate decades of public health gains. Countering this bleak forecast for America’s health entails more than new law and policy approaches. It requires an innovative vision of the core role of law to further communal health. Part I of this commentary3 premised the promotion of the public’s health on the truism of “constitutional cohesion.” For many reasons constitutional structural principles (e.g., federalism, separation of powers) are often viewed distinctly from individual rights (e.g., due process, freedom of speech). The Bill of Rights to the federal Constitution was added only after structural foundations were laid out. For years, law schools have taught structural principles and rights in separate courses. Unsurprisingly, many lawyers, judges, and policymakers tend to see them discretely. In reality, structuraland rights-based constitutional norms are highly interdependent, working in tandem to limit governmental vices (e.g., oppression, overreaching, malfeasance, tyranny) (see Figure 1).4 Constitutional cohesion is a fine theory, but so what? In a 1969 lecture, Yale Law Professor Charles L. Black, Jr. forewarned: “One who reads at all in constitutional law will know, ruefully, that there is no new thing to be said, and that when you think you Constitutional Cohesion and Public Health Promotion Part II
