Columna1;title;abstract
328;Climate Change, Weather, Housing Precarity, and Homelessness: A Systematic Review of Reviews;This systematic review of reviews was conducted to examine housing precarity and homelessness in relation to climate change and weather extremes internationally. In a thematic analysis of 15 reviews (5 systematic and 10 non-systematic), the following themes emerged: risk factors for homelessness/housing precarity, temperature extremes, health concerns, structural factors, natural disasters, and housing. First, an increased risk of homelessness has been found for people who are vulnerably housed and populations in lower socio-economic positions due to energy insecurity and climate change-induced natural hazards. Second, homeless/vulnerably-housed populations are disproportionately exposed to climatic events (temperature extremes and natural disasters). Third, the physical and mental health of homeless/vulnerably-housed populations is projected to be impacted by weather extremes and climate change. Fourth, while green infrastructure may have positive effects for homeless/vulnerably-housed populations, housing remains a major concern in urban environments. Finally, structural changes must be implemented. Recommendations for addressing the impact of climate change on homelessness and housing precarity were generated, including interventions focusing on homelessness/housing precarity and reducing the effects of weather extremes, improved housing and urban planning, and further research on homelessness/housing precarity and climate change. To further enhance the impact of these initiatives, we suggest employing the Human Rights-Based Approach (HRBA).
329;Public health and climate change: How are local authorities preparing for the health impacts of our changing climate?;ABSTRACT Background Local authorities have a crucial role in preparing for the impacts of climate change. However, the extent to which health impacts are being prioritized and acted on is not well understood. Methods We investigated the role of public health in adapting to climate change through: (i) a content analysis of local authority climate change adaptation strategies in South West England and (ii) semi-structured telephone interviews with local authority public health consultants and sustainability officers and a regional Public Health England representative (n = 11). Results Adaptation strategies/plans varied in existence and scope. Public health consultants did not have an explicit remit for climate change adaptation, although related action often aligned with public health’s emergency planning functions. Key barriers to health-related adaptation were financial constraints, lack of leadership and limited public and professional awareness about health impacts. Conclusions Local authorities in South West England have differing approaches to tackling health impacts of climate change, and the prominence of public health arguments for adaptation varies. Improved public health intelligence, concise communications, targeted support, visible local and national leadership and clarity on economic costs and benefits of adaptation would be useful for local authorities in preparing for the health impacts of climate change.
330;Observed and Projected Impacts of Climate Change on Marine Fisheries, Aquaculture, Coastal Tourism, and Human Health: An Update;The Intergovernmental Panel on Climate Change (IPCC) Fifth Assessment Report (AR5) states that climate change and ocean acidification are altering the oceans at a rate that is unprecedented compared with the recent past, leading to multifaceted impacts on marine ecosystems, associated goods and services, and human societies. AR5 underlined key uncertainties that remain regarding how synergistic changes in the ocean are likely to affect human systems, and how humans are likely to respond to these events. As climate change research has accelerated rapidly following AR5, an updated synthesis of available knowledge is necessary to identify emerging evidence, and to thereby better inform policy discussions. This paper reviews the literature to capture corroborating, conflicting, and novel findings published following the cut-off date for contribution to AR5. Specifically, we highlight key scientific developments on the impacts of climate-induced changes in the ocean on key socioeconomic sectors, including fisheries, aquaculture and tourism. New evidence continues to support a climate-induced redistribution of benefits and losses at multiple scales and across coastal and marine socio-ecological systems, partly resulting from species and ecosystem range shifts and changes in primary productivity. New efforts have been made to characterize and value ecosystem services in the context of climate change, with specific relevance to ecosystem-based adaptation. Recent studies have also explored synergistic interactions between climatic drivers, and have found strong variability between impacts on species at different life stages. Although climate change may improve conditions for some types of freshwater aquaculture, potentially providing alternative opportunities to adapt to impacts on wild capture fisheries, ocean acidification poses a risk to shellfish fisheries and aquaculture. The risk of increased prevalence of disease under warmer temperatures is uncertain, and may detrimentally affect human health. Climate change may also induce changes in tourism flows, leading to substantial geospatial shifts in economic costs and benefits associated with tourism revenue and coastal infrastructure protection and repairs. While promising, ecosystem-based coastal adaptation approaches are still emerging, and require an improved understanding of key ecosystem services and values for coastal communities in order to assess risk, aid coastal development planning, and build decision support systems.
331;Heat Exposure and Maternal Health in the Face of Climate Change;Climate change will increasingly affect the health of vulnerable populations, including maternal and fetal health. This systematic review aims to identify recent literature that investigates increasing heat and extreme temperatures on pregnancy outcomes globally. We identify common research findings in order to create a comprehensive understanding of how immediate effects will be sustained in the next generation. Following the Preferred Reporting Items for Systematic Reviews and Meta-Analyses (PRISMA) guide, we systematically reviewed articles from PubMed and Cochrane Reviews. We included articles that identify climate change-related exposures and adverse health effects for pregnant women. There is evidence that temperature extremes adversely impact birth outcomes, including, but not limited to: changes in length of gestation, birth weight, stillbirth, and neonatal stress in unusually hot temperature exposures. The studies included in this review indicate that not only is there a need for further research on the ways that climate change, and heat in particular, may affect maternal health and neonatal outcomes, but that uniform standards for assessing the effects of heat on maternal fetal health also need to be established.
332;Energy insecurity: a framework for understanding energy, the built environment, and health among vulnerable populations in the context of climate change.;The author reflects on climate change and on the impact that climate change has on the built environment and public health. She suggests that the effects of climate change are experienced in the built environments which surround most individuals. She argues that as the effects of climate change become more apparent greater attention and approaches to increase awareness and reduce climate change are necessary to protect public health.
333;Health Impact of Climate Change in Older People: An Integrative Review and Implications for Nursing;PURPOSE Older people account for the highest proportion of mortality from extreme weather events associated with climate change. This article aims to describe the health impacts of climate change on older people.   TYPE OF STUDY An integrative review was conducted with 30 studies retrieved from PubMed, EBSCO, and the Cumulative Index to Nursing and Allied Health Literature (CINAHL) on climate stressors, determinants of resilient capacity, risk factors, and health outcomes.   FINDINGS Heat, temperature variability, and air pollution increase mortality risk in older people, especially from cardiovascular and respiratory diseases. Floods are linked with increasing incidence of post-traumatic stress disorder, depression, and anxiety. Facing these adversities, older people exhibit both vulnerability and resilience.   CONCLUSIONS Research gaps exist in understanding the full spectrum of the resilience experience of older people, and appreciating areas wherein nursing can play a pivotal role.   CLINICAL RELEVANCE Recognizing the vulnerabilities of older people in the context of climate change is important. Identifying opportunities to promote resilience is an important focus for nurses to develop tailored and targeted nursing interventions.
334;Climate Change and Eutrophication: A Short Review;Water resources are vital not only for human beings but essentially all ecosystems. Human health is at risk if clean drinking water becomes contaminated. Water is also essential for agriculture, manufacturing, energy production and other diverse uses. Therefore, a changing climate and its potential effects put more pressure on water resources. Climate change may cause increased water demand as a result of rising temperatures and evaporation while decreasing water availability. On the other hand, extreme events as a result of climate change can increase surface runoff and flooding, deteriorating water quality as well. One effect is water eutrophication, which occurs when high concentrations of nutrients, such as nitrogen and phosphorus, are present in the water. Nutrients come from different sources including agriculture, wastewater, stormwater, and fossil fuel combustion. Algal blooms can cause many problems, such as deoxygenation and water toxicity, ultimately disrupting normal ecosystem functioning. In this paper, we investigate the potential impacts of climatic factors affecting water eutrophication, how these factors are projected to change in the future, and what their projected potential impacts will be.
335;Detecting and Attributing Health Burdens to Climate Change;Background: Detection and attribution of health impacts caused by climate change uses formal methods to determine a) whether the occurrence of adverse health outcomes has changed, and b) the extent to which that change could be attributed to climate change. There have been limited efforts to undertake detection and attribution analyses in health. Objective: Our goal was to show a range of approaches for conducting detection and attribution analyses. Results: Case studies for heatwaves, Lyme disease in Canada, and Vibrio emergence in northern Europe highlight evidence that climate change is adversely affecting human health. Changes in rates and geographic distribution of adverse health outcomes were detected, and, in each instance, a proportion of the observed changes could, in our judgment, be attributed to changes in weather patterns associated with climate change. Conclusions: The results of detection and attribution studies can inform evidence-based risk management to reduce current, and plan for future, changes in health risks associated with climate change. Gaining a better understanding of the size, timing, and distribution of the climate change burden of disease and injury requires reliable long-term data sets, more knowledge about the factors that confound and modify the effects of climate on health, and refinement of analytic techniques for detection and attribution. At the same time, significant advances are possible in the absence of complete data and statistical certainty: there is a place for well-informed judgments, based on understanding of underlying processes and matching of patterns of health, climate, and other determinants of human well-being. https://doi.org/10.1289/EHP1509
336;Scientific review of the impact of climate change on plant pests;Climate change represents an unprecedented challenge to the world?s biosphere and to the global community. It also represents a unique challenge for plant health. Human activities and increased market globalization, coupled with rising temperatures, has led to a situation that is favourable to pest movement and establishment. This scientific review assesses the potential effects of climate change on plant pests and consequently on plant health. The evidence assessed strongly indicates that climate change has already expanded some pests? host range and geographical distribution, and may further increase the risk of pest introduction to new areas. This calls for international cooperation and development of harmonized plant protection strategies to help countries successfully adapt their pest risk management measures to climate change.
337;The need for clean air: The way air pollution and climate change affect allergic rhinitis and asthma;Air pollution and climate change have a significant impact on human health and well‐being and contribute to the onset and aggravation of allergic rhinitis and asthma among other chronic respiratory diseases. In Westernized countries, households have experienced a process of increasing insulation and individuals tend to spend most of their time indoors. These sequelae implicate a high exposure to indoor allergens (house dust mites, pets, molds, etc), tobacco smoke, and other pollutants, which have an impact on respiratory health. Outdoor air pollution derived from traffic and other human activities not only has a direct negative effect on human health but also enhances the allergenicity of some plants and contributes to global warming. Climate change modifies the availability and distribution of plant‐ and fungal‐derived allergens and increases the frequency of extreme climate events. This review summarizes the effects of indoor air pollution, outdoor air pollution, and subsequent climate change on asthma and allergic rhinitis in children and adults and addresses the policy adjustments and lifestyle changes required to mitigate their deleterious effects.
338;Climate change impacts on human health over Europe through its effect on air quality;This review examines the current literature on the effects of future emissions and climate change on particulate matter (PM) and O3 air quality and on the consequent health impacts, with a focus on Europe. There is considerable literature on the effects of climate change on O3 but fewer studies on the effects of climate change on PM concentrations. Under the latest Intergovernmental Panel on Climate Change (IPCC) 5th assessment report (AR5) Representative Concentration Pathways (RCPs), background O3 entering Europe is expected to decrease under most scenarios due to higher water vapour concentrations in a warmer climate. However, under the extreme pathway RCP8.5 higher (more than double) methane (CH4) abundances lead to increases in background O3 that offset the O3 decrease due to climate change especially for the 2100 period. Regionally, in polluted areas with high levels of nitrogen oxides (NOx), elevated surface temperatures and humidities yield increases in surface O3 – termed the O3 climate penalty – especially in southern Europe. The O3 response is larger for metrics that represent the higher end of the O3 distribution, such as daily maximum O3. Future changes in PM concentrations due to climate change are much less certain, although several recent studies also suggest a PM climate penalty due to high temperatures and humidity and reduced precipitation in northern mid-latitude land regions in 2100.A larger number of studies have examined both future climate and emissions changes under the RCP scenarios. Under these pathways the impact of emission changes on air quality out to the 2050s will be larger than that due to climate change, because of large reductions in emissions of O3 and PM pollutant precursor emissions and the more limited climate change response itself. Climate change will also affect climate extreme events such as heatwaves. Air pollution episodes are associated with stagnation events and sometimes heat waves. Air quality during the 2003 heatwave over Europe has been examined in numerous studies and mechanisms for enhancing O3 have been identified.There are few studies on health effects associated with climate change impacts alone on air quality, but these report higher O3-related health burdens in polluted populated regions and greater PM2.5 health burdens in these emission regions. Studies that examine the combined impacts of climate change and anthropogenic emissions change under the RCP scenarios report reductions in global and European premature O3-respiratory related and PM mortalities arising from the large decreases in precursor emissions. Under RCP 8.5 the large increase in CH4 leads to global and European excess O3-respiratory related mortalities in 2100. For future health effects, besides uncertainty in future O3 and particularly PM concentrations, there is also uncertainty in risk estimates such as effect modification by temperature on pollutant-response relationships and potential future adaptation that would alter exposure risk.
339;Understanding human influence on climate change in China;Abstract China's climate has been warming since the 1950s, with surface air temperature increasing at a rate higher than the global average. Changes in climate have exerted substantial impacts on water resources, agriculture, ecosystems and human health. Attributing past changes to causes provides a scientific foundation for national and international climate policies. Here, we review recent progress in attributing the observed climate changes over past decades in China. Anthropogenic forcings, dominated by greenhouse gas emissions, are the main drivers for observed increases in mean and extreme temperatures. Evidence of the effect of anthropogenic forcings on precipitation is emerging. Human influence has increased the probability of extreme heat events, and has likely changed the occurrence probabilities for some heavy precipitation events. The way a specific attribution question is posed and the conditions under which the question is addressed present persistent challenges for appropriately communicating attribution results to non-specialists.
340;Media Exposure to Climate Change, Anxiety, and Efficacy Beliefs in a Sample of Italian University Students;The climate crisis poses a serious threat to the health and well-being of individuals. For many, climate change knowledge is derived from indirect exposure to information transmitted through the media. Such content can elicit a variety of emotional responses, including anger, sadness, despair, fear, and guilt. Worry and anxiety are especially common responses, usually referred to as “climate anxiety”. The main objectives of this study were to analyze how exposure to climate change through the media relates to climate anxiety and individual and collective self-efficacy, and to evaluate the relationship between climate anxiety and efficacy beliefs. A total of 312 Italian university students (aged 18–26 years) participated in the research by filling out an anonymous questionnaire. Participants reported being exposed several times per week to information about climate change, especially from social media, newspapers, and television programs. Moreover, the results showed that the attention paid to information about climate change was not only positively related to climate anxiety, but also to individual and collective self-efficacy. Most notably, participants’ efficacy beliefs were found to be positively related to climate anxiety. This somewhat controversial finding stresses that, in the context of pro-environmental behavior changes, a moderate level of anxiety could engender feelings of virtue, encouraging people to rethink actions with negative ecological impacts.
341;Multiple Threats to Child Health from Fossil Fuel Combustion: Impacts of Air Pollution and Climate Change;"Background: Approaches to estimating and addressing the risk to children from fossil fuel combustion have been fragmented, tending to focus either on the toxic air emissions or on climate change. Yet developing children, and especially poor children, now bear a disproportionate burden of disease from both environmental pollution and climate change due to fossil fuel combustion. Objective: This commentary summarizes the robust scientific evidence regarding the multiple current and projected health impacts of fossil fuel combustion on the young to make the case for a holistic, child-centered energy and climate policy that addresses the full array of physical and psychosocial stressors resulting from fossil fuel pollution. Discussion: The data summarized here show that by sharply reducing our dependence on fossil fuels we would achieve highly significant health and economic benefits for our children and their future. These benefits would occur immediately and also play out over the life course and potentially across generations. Conclusion: Going beyond the powerful scientific and economic arguments for urgent action to reduce the burning of fossil fuels is the strong moral imperative to protect our most vulnerable populations. Citation: Perera FP. 2017. Multiple threats to child health from fossil fuel combustion: impacts of air pollution and climate change. Environ Health Perspect 125:141–148; http://dx.doi.org/10.1289/EHP299"
342;Assessment of Risk, Vulnerability and Adaptation to Climate Change by the Health Sector in Madagascar;"Madagascar is cited as one of the most vulnerable countries to the effects of climate change, with significant impacts to the health of its population. In this study, the vulnerability of Madagascar’s health sector to climate change was assessed and appropriate adaptation measures were identified. In order to assess climate risks, vulnerability and identify adaptation options, the Madagascar Ministry of Public Health as well as the National Meteorological and Hydrological Service worked in close collaboration with a team of local experts to conduct a literature review, field surveys, and analyses of current and future climate and health trends. Four climate-sensitive diseases of primary concern are described in the study: acute respiratory infections (ARI), diarrhea, malnutrition, and malaria. Baseline conditions of these four diseases from 2000 to 2014 show acute respiratory infections and diarrheal diseases are increasing in incidence; while incidence of malnutrition and malaria decreased over this period. To assess future impacts in Madagascar, this baseline information was used with climate projections for the two scenarios—RCP 4.5 and RCP 8.5—for the periods 2016–2035, 2036–2070 and 2071–2100. Future climate conditions are shown to exacerbate and increase the incidence of all four climate sensitive diseases. Further analysis of the exposure, sensitivity and adaptive capacity to the climate hazards suggests that the health sector in four regions of Madagascar is particularly vulnerable. The study recommends adaptation measures to improve the monitoring and early warning systems for climate sensitive diseases, as well as to reduce population vulnerability."
343;Forest health in a changing world: Effects of globalization and climate change on forest insect and pathogen impacts;Forests and trees throughout the world are increasingly affected by factors related to global change. Expanding international trade has facilitated invasions of numerous insects and pathogens into new regions. Many of these invasions have caused substantial forest damage, economic impacts and losses of ecosystem goods and services provided by trees. Climate change is already affecting the geographic distribution of host trees and their associated insects and pathogens, with anticipated increases in pest impacts by both native and invasive pests. Although climate change will benefit many forest insects, changes in thermal conditions may disrupt evolved life history traits and cause phenological mismatches. Individually, the threats posed to forest ecosystems by invasive pests and climate change are serious. Although interactions between these two drivers and their outcomes are poorly understood and hence difficult to predict, it is clear that the cumulative impacts on forest ecosystems will be exacerbated. Herewe introduce and synthesize the information in this special issue of Forestry with articles that illustrate the impacts of invasions of insects and pathogens, climate change, forest management and their interactions, as well as methods to predict, assess and mitigate these impacts. Most of these contributions were presented at the XXIV IUFROWorld Congress in 2014.
